{
  "$schema": "https://json-schema.org/draft/2020-12/schema",
  "$id": "https://openlabs.local/schemas/openlabs.project.v1.schema.json",
  "title": "OpenLabs pluggable research project v1",
  "type": "object",
  "additionalProperties": true,
  "required": [
    "schema_version",
    "project_id",
    "domain",
    "status",
    "objective",
    "protocol",
    "workstreams"
  ],
  "properties": {
    "schema_version": {"const": "openlabs.project.v1"},
    "project_id": {"type": "string", "minLength": 1, "maxLength": 128},
    "domain": {"type": "string", "minLength": 1},
    "status": {"enum": ["active", "paused", "retired"]},
    "objective": {"type": "string", "minLength": 1},
    "protocol": {
      "type": "object",
      "additionalProperties": false,
      "required": ["id", "primary_skill"],
      "properties": {
        "id": {"type": "string", "minLength": 1},
        "primary_skill": {"type": "string", "minLength": 1}
      }
    },
    "execution": {
      "type": "object",
      "additionalProperties": false,
      "properties": {
        "default_session_mode": {"enum": ["resume", "fresh"]},
        "fresh_session_boundaries": {
          "type": "array",
          "items": {
            "enum": [
              "role_handoff",
              "text_revision",
              "evidence_remediation",
              "independent_replication",
              "adversarial_review",
              "portfolio_review",
              "route_reselection"
            ]
          },
          "uniqueItems": true
        }
      }
    },
    "domain_config": {
      "type": "object",
      "required": ["path"],
      "properties": {"path": {"type": "string", "minLength": 1}}
    },
    "research_index": {
      "type": "object",
      "additionalProperties": false,
      "required": ["path"],
      "properties": {
        "path": {"type": "string", "minLength": 1},
        "source_campaign_ids": {
          "type": "array",
          "items": {"type": "string", "minLength": 1},
          "uniqueItems": true
        }
      }
    },
    "read_resources": {
      "type": "array",
      "items": {
        "type": "object",
        "additionalProperties": false,
        "required": ["label", "path"],
        "properties": {
          "label": {"type": "string", "minLength": 1},
          "path": {"type": "string", "minLength": 1}
        }
      }
    },
    "portfolio": {
      "type": "object",
      "additionalProperties": true,
      "properties": {
        "allow_dynamic_candidate_workstreams": {"type": "boolean"},
        "candidate_maturation_instruction": {"type": "string"},
        "candidate_state_template": {"type": "object"}
      }
    },
    "workstreams": {
      "type": "array",
      "minItems": 1,
      "items": {
        "type": "object",
        "additionalProperties": true,
        "required": ["workstream_id", "state_path"],
        "properties": {
          "workstream_id": {"type": "string", "minLength": 1, "maxLength": 128},
          "title": {"type": "string"},
          "state_path": {"type": "string", "minLength": 1},
          "startup": {"enum": ["active", "paused"]},
          "priority": {"type": "integer"},
          "objective": {"type": "string"},
          "agent_role": {
            "enum": ["researcher", "experimenter", "writer", "reviewer"]
          },
          "session_mode": {"enum": ["resume", "fresh"]},
          "continuation": {
            "enum": ["continuous", "review_on_new_results"]
          },
          "wall_seconds": {"type": "integer", "minimum": 1},
          "max_agent_seconds": {"type": "integer", "minimum": 1},
          "resources": {
            "type": "object",
            "additionalProperties": false,
            "required": ["cpu_threads", "memory_mib", "scratch_mib"],
            "properties": {
              "cpu_threads": {"type": "integer", "minimum": 1},
              "memory_mib": {"type": "integer", "minimum": 1},
              "scratch_mib": {"type": "integer", "minimum": 1}
            }
          },
          "review_every_results": {"type": "integer", "minimum": 1},
          "review_batch_size": {"type": "integer", "minimum": 1},
          "spawn_candidate_workstreams": {"type": "boolean"}
        }
      }
    }
  }
}
